id,authors,category,date,header,medium,format,genre,mediumType,price,section,text
81589602,['Laura Quintero'],REVISTA,2019-09-21T14:07:07Z,La escalera de Laura // Vulnerables,Vértigo,IMPRESO,Columna Política,Semanario Político,29696.5,Nacional,"riesgo de ser agredidos y abusados sexualmente o a otro tipo de violencia, cuando en estos tiempos la delincuencia está desatada y por su vulnerabilidad son presa fácil de esos grupos: de acuerdo con el Instituto de Atención a los Adultos Mayores se reportan más de mil 500 casos. Esta población de adultos mayores es muy vulnerable y para los casos que pudieran darse las sanciones deben incrementarse porque actualmente el delito de abandono es de tres meses a tres años. Por ello sugiero que sea de tres a ocho años de prisión, para lo cual habrá que reformar el Código Penal capitalino”, señala el diputado panista Christian von Roehrich. Es cierto: cada vez es más constante el abandono de los viejitos por parte de sus hijos y demás familiares. Esto debido a que según ellos no tienen tiempo para atenderlos. Con engaños los sacan a la calle. Los sientan en una banca de algún parque. Se levantan diciéndoles que ahorita regresan. Y simplemente ya no vuelven por ellos. Ahí se quedan los indefensos viejitos sin saber qué hacer. Ni para dónde ir. Hay muchos casos así. ¿O acaso me equivoco? Es necesario castigar a los responsables de poner en peligro la vida de cualquier persona abandonándola en la calle, a su suerte”, dice el también vicecoordinador del grupo parlamentario de Acción Nacional. Resulta injusto a todas luces abandonar a una persona mayor porque ya se cansaron de ella y representa una carga que no están dispuestos a llevar con dignidad. Ya ve que si no los dejan en la calle los van a aventar a un refugio o asilo, donde no los van a visitar casi nunca. Y ellos viven con la esperanza de algún día ver a alguno de sus hijos llegar a verlos, pues los padres lo son hasta el final. ¿O no? El diputado Von Rochrich reconoce que en la Ciudad de México hay además miles de menores que se encuentran sin el cuidado de sus padres. Viven enla calle, perdidos, en el abandono y expuestos a la explotación. Y no hay cifras oficiales de abandono. El Sistema Nacional para el Desarrollo Integral de la Familia (D1r) local no da a conocer el número de recién nacidos que fueron rescatados de la calle y que se logró canalizar a algún lugar seguro”. Tiene razón: hay que castigar también a quienes abandonen a sus hijos. Es imperdonable que los tiren como si fueran basura. Si 22 de septiembre de 2019 iputados locales proponen incrementar de tres a ocho años de cárcel las sanciones para personas que abandonen en la calle a adultos mayores y niños, porque los exponen al Es necesario castigar a los responsables de poner en peligro la vida de cualquier persona abandonandola en la calle”. no los quieren hay muchos métodos para no embarazarse, que se venden en cualquier farmacia, pues eso dejó de ser tabú. O bien si nolo quieren entréguenselo a una persona que lo pueda cuidar. Hay tantas parejas que desean un hijo y no lo tienen por diversas razones. ¿O cómo ve? Ojalá y de verdad se haga conciencia para proteger a estos sectores, pues. El bolso de Laura... Ahora le cuento que los diputados locales exhortan a los consejeros delasalcaldías a que acaten su obligación porque a un año de haber iniciado labores no han cumplido con la rendición de cuentas y la transparencia. Se dice que en todos estos meses no hay ni reglamento de información y mucho menos de los acuerdos tomados en cada una de las alcaldías. No cabe duda que la opacidad es lo suyo. ¿Será?.. No diga que yo se lo conté pero se dice que no habrá más construcciones en la Ciudad de México. Por lo tanto no se aprobaría la ley de Planeación ni la de Desarrollo Metropolitana si no se toma en cuenta el desarrollo hídrico de la urbe porque nos estamos hundiendo debido a la sobreexplotación de los mantos freáticos, que de hecho se van a cerrar varios para evitar socavones. Y se agravará más la escasez, que ya empezó con la reducción que iniciaron las autoridades la semana pasada. Así de grave la situación, ¿ch? I Von Roehrich | Propuesta. O21X3W p pepn1) el ap osa1su03"
81751501,['Sergio Sarmiento'],REVISTA,2019-09-29T11:19:05Z,Jaque mate // El Juicio de la Historia,Vértigo,IMPRESO,Columna Política,Semanario Político,29509.1,Nacional,"George Orwell, el escritor inglés que escribió la clásica novela 1984 afirmaba que quien controla el pasado controla el futuro; quien controla el presente controla el pasado”. No sé si el presidente Andrés Manuel López Obrador haya conocido esta frase de Orwell pero ciertamente la ha aplicado en su gobierno. Su afán de usar su fuerza política presente — que surge de una abrumadora popularidad — para redefinir la historia y preparar la construcción de una imagen futura para su régimen ha sido una constante de su mandato. Las referencias en sus conferencias de prensa y discursos a los conflictos entre conservadores y liberales reflejan esta obsesión con la historia. Lo ha sido también la decisión de rendir un homenaje en la antigua residencia oficial de Los Pinos a dos sobrevivientes del ataque al cuartel militar de Madera, en Chihuahua, en 1965, un ataque en el que murieron seis soldados. El gobierno mexicano ofreció, por otra parte, una disculpa pública a una exguerrillera, Martha Camacho, quien fue torturada por elementos militares que la obligaron a presenciar el asesinato de su esposo, también guerrillero. Respecto del tema de la guerrilla el historiador Pedro Salmerón, quien ocupaba el cargo de director del Instituto Nacional de cargo de director del Instituto Nacional de Estudios Históricos de las Revoluciones Mexicanas, dio a conocer comentarios en los que calificaba de valientes” a los guerrilleros que el 17 de septiembre de 1973 asesinaron al empresario Eugenio Garza Sada, de 81 años, así como a dos de sus escoltas, en un intento de secuestro. Nadie puede objetar que se ofrezca Lo que sin duda lo obsesiona es el juicio de la historia”. una disculpa a una mujer torturada por las Fuerzas Armadas y obligada a presenciar el asesinato de su esposo. Pero mientras se rinde un homenaje en Los Pinos a los sobrevivientes del asalto al cuartel de Madera nadie piensa en los soldados muertos en ese ataque que no tuvo ninguna provocación previa por parte del Ejército. La alabanza a los valientes” guerrilleros que asesinaron a Garza Sada le costó cl puesto a Salmerón, pero refleja el punto de vista de muchos en el gobierno. No podemos olvidar que el subsecretario de Educación, Luciano Concheiro, ha señalado que México debe vivir en un régimen comunista. Huella Tengo la impresión de que López Obrador está muy alejado de esa ideología. El presidente es, finalmente, un hijo de tendero de Macuspana. Si bien se ha comprometido a privilegiar a los pobres no parece inclinado a un régimen comunista. Sus políticas han respetado hasta ahora el sistema de libre empresa. Lo que sin duda lo obsesiona, sin embargo, es el juicio de la historia. Este ha sido desde un principio uno de los temas fundamentales de su gobierno. Por eso redefinió la historia nacional y la dividió en tres grandes transformaciones para añadir que su gobierno sería la cuarta; por eso muchas de las decisiones que toma están inspiradas en el ejemplo de los próceres del pasado, como Hidalgo, Juárez, Madero y Cárdenas. Esta conciencia de la historia me parece saludable, aunque algunas de las interpretaciones que hace parecen simplistas y maniqueas. En el caso de las guerrillas de la década de 1970, por ejemplo, es importante entender que el país no vivió una simple historia de héroes y villanos en que los guerrilleros eran buenos y los militares malos. Si bien hay que condenara esos militares que torturaron o realizaron ejecuciones extrajudiciales, no podemos homenajear a quienes mataban a soldados o a empresarios como si solo la vida de los guerrilleros tuviera valor, no por lo menos si el presidente quiere el respaldo de las Fuerzas Armadas y los empresarios para construir un mejor país y dejar una huella positiva en la historia nacional."
81751986,['Juan Pablo Delgado Cantú'],REVISTA,2019-09-28T12:02:29Z,El Árbol de las Moras // El impopular Populismo,Vértigo,IMPRESO,Columna Política,Semanario Político,45256.2,Nacional,"hora sí, compañeros: ¡tenemos buenas noticias! Los ávidos lectores de [7 árbol de moras recordarán que en mi columna anterior descendimos a las oscuras profundidades de la geopolítica contemporánca. Argu- menté en aquel momento a favor de la teoría de la eterna espiral”, apuntando que nos encontramos dando vueltas en remolinos histó- ricos y cómo —por lo mismo — el mundo parecía estar atascado. Mencioné algunos ejemplos: a Colombia y las rxrC; al Reino Unido y el Brexit; al muro fronterizo de Trump; a la guerra en Afganistán; a la crisis de Argentina, y al espectro de una nueva recesión econó- mica global. ¿Pero qué creen, chatos? ¡Parece que por fin logramos escapar de un remolino! Y citando a la gran poeta peruana Juana Judith Bustos (mejor conocida como La tigresa del Orien- fe): ¡tendremos un nuevo amanecer! ¿A qué merefiero? Pues de acuerdo con diversos analistas la era del populismo que ha asolado a las democracias liberales de Occidente durante una década parece estar llegando a su final. Las señales están en todas partes: en Gran Bretaña el gobierno populachero de Boris Johnson se tambalea por su terrible actuación con el Brexit. En Israel la reciente elección parece haber arrebatado el poder a Benjamin Netanyahu, quien se encaminaba a crear una especie de teocracia ultranacionalista. En ltalia el xenófobo Matteo Salvini fue sacado a patadas del gobierno de coalición que tenía con el Movimiento > Estrellas, el cual prefirió una alianza conlos liberales moderados del Partido Democrático. En España el presidente Pedro Sánchez le cerró las puertas a Pablo Iglesias y sus camaradas bolcheviques de Podemos. En Hrancia Emmanuel Macron sorteó la tormenta antiestablishment de los chalecos amarillos y detuvo el auge en las encuestas de la racista Marine Le Pen. En Austria la coalición entre los conservadores y los ultraderechistas colapsó cuando se reveló una trama de corrupción entre el líder del Partido de la Libertad y unos empresarios rusos. En Alemania todos los partidos tradicionales se aliaron contra los neonazis de Alternative ftir Deutschland. En Polonia se especula que Jaroslaw Kaczynski y su partido Ley y Orden puedan perder su mayoría en las elecciones del 13 de octubre. Turbulencia Nada de esto significa que hemos llegado a un puerto seguro. En Europa, Hungría sigue bajo el yugo de Viktor Orban; en Brasil, Jair Bolsonaro apenas empieza su régimen de destrucción; en India, Narendra Modi avanza su agenda contra las minorías religiosas; en Filipinas, Rodrigo Duterte sigue con su estrategia asesina, y si el destino nos juega una cruel broma, el año próximo podría reclegirse Donald Trump. Deigual manera, como bien explica Paul Taylor en Político, las fuerzas subyacentes que motivaron el auge populista siguen presentes: existe una erosión generalizada en los cimientos democráticos y persiste la creciente desigualdad de ingresos, las preocupaciones sobre la migración y la desaparición de empleos poco calificados por la globalización”. Aun asf yo sí quisiera detenerme por lo menos un segundo para celebrar el evidente progreso. Porque después de diez años de transitar por turbulencia parece que el mundo comienza nuevamente a recobrar susentido, razón y cordura. Pero no durmamos sobre laureles: el populismo aún no está derrotado y no hemos ni mencionado a los regímenes verdaderamente autoritarios como China y Rusia, que tienen en jaque al orden liberal. Pero bien dice el clásico: Vámonos despacio porque vamos lejos”. Porlo pronto yo empiezo lasemana celebrando con un whiskito en las rocas. ¡Salud, amigos!"
81752406,['Laura Quintero'],REVISTA,2019-09-28T12:40:39Z,La Escalera de Laura // Fondo de capitalidad,Vértigo,IMPRESO,Columna Política,Semanario Político,33618.9,Nacional,"n la pasada Asamblea Legislativa se rasgaban las vestiduras por obtener el Fondo de Capitalidad para el Gobierno de la Ciudad, que alcanzó hasta los cuatro mil millones de pesos, pero ahora desapareció, así nomás: este año la administración capitalina no recibió ni un centavo y por eso diputados de Acción Nacional van por reactivar ese fondo y que quede en la ley, no al capricho. La Ley de Capitalidad creará el Fondo de Capitalidad para la Ciudad de México, que destine de tres a cuatro mil millones de pesos anuales, lo que beneficiará a la CDMX con más recursos públicos por que podrá contar con recursos para mitigar su condición de capital y hacer frente a demandas de infraestructura”, dice el diputado promotor de la iniciativa, Jorge Triana. Es muy buena idea reactivar este Fondo de Capitalidad, que inicialmente promovió el partido del sol azteca y gracias a los recursos que recibió del gobieno federal impulsó varios programas en beneficio de la población más necesitada de la ciudad. Y ahora cuando se revisa el proyecto de presupuesto para el año próximo es el momento de luchar por que la ciudad vuelva a recibir esos fondos. ¿Qué le parece? No entendemos por qué el partido de la mayoría se echó para atrás y se desdijo cuando desde un principio aseveró que era su prioridad este estatuto de capitalidad. Ahorita estamos en el momento oportuno Triana | Reactivación. o2xew ap pepni) el ap para presentar esta ley, que se apruebe y pueda llegar este recurso en el marco de la aprobación del Paquete Presupuestal 2020, porque quienes elaboraron el presupuesto no lo incluyeron”, advierte Triana. De aprobarse esta nueva legislación se crearía un Consejo Consultivo integrado por lostitulares de la Secretaría de Gobernación, la Secretaría de Hacienda, el Gobierno de la CDMxX y la Secretaría de Finanzaslocal, donde ala vez se diseñaría su reglamento y fórmulas de distribución presupuestaria, en beneficio de por lo menos nueve millones de capitalinos y dos millones de personas más como población flotante diaria”, explica el diputado. Bueno, pues es un marco que transparentaría el buen destino de los recursos otorgados al Fondo de Capitalidad, porque es muy importante el diseño de la integración, en este caso, de un Consejo Consultivo conformado por representantes de varias dependencias para evitar las suspicacias que siempre despierta el manejo de tantos millones de pesos. Esperemos que todos los legisladores de este primer Congreso analicen las ventajas de continuar con este Fondo. ¡Ojalá! El bolso de Laura... Ahora le cuento que se comenta que la situación del abastecimiento del agua está grave. Y es en serio. Se dice enlos pasillos de Donceles que el nivel de agua en la presa del Cutzamala se encuentra a 75% y a eso se debe la escasez que hay del vital líquido en la ciudad. Ante el déficit que existe habría que aprovechar los millones de litros de agua de lluvia que se desperdician. La Ciudad de México importa casi 40% de su agua de fuentes distantes y no cuenta con infraestructura para su captación. De ahíla importancia del Fondo de Capitalidad... Y ante tanto feminicidio y abusos contra las mujeres se sabe que los diputados locales pretenden castigar penalmente a todas aquellas personas que filtren o difundan packs en detrimento de las féminas. Reconocen que cuando se modificó el artículo 183 bis del Código Penal de la Ciudad de México no previeron definir con exactitud que la violencia digital es violencia que el Estado debe sancionar. Y en eso trabajan. ¡Veremos!... Bl Buscan definir un Fondo de Capitalidad para la CDMX que destine hasta cuatro mil millones de pesos anuales”. www.vertigopolitico.com"
81752422,['Lourdes Mendoza'],REVISTA,2019-09-29T12:41:48Z,Estilos // AMLO ¿Empresario?,Vértigo,IMPRESO,Columna Política,Semanario Político,25649.7,Nacional,"Ya ni la amuelan: ahora resulta que Andrés Manuel López Obrador y su esposa Beatriz eran los supuestos socios de 26 empresas creadas en Veracruz el 15 de agosto de 2019. A Arturo Herrera, secretario de Hacienda, y a Margarita Ríos Farjat, jefa del SAT, los tendremos en el radar porque queremos saber quién se atrevió a semejante cosa justo en medio de la discusión para que la creación de empresas fantasma se considere delito grave. ¡Me rayé! Me convertí en empresario”, dijo en tono sarcástico el presidente, quien destacó que el registro de las empresas lo realizó Claudia Martínez Rodríguez, asesora fiscal integral de la Administración Desconcentrada de Servicios Tributarios en Veracruz. La cuestión también es saber por qué Veracruz, entidad icono de la delincuencia fiscal organizada, cortesía de la administración de Javier Duarte, conocido como Javidú, el preso con más libertades. Basta con recordar que en tiempos de este personaje se identificaron las facturas y las empresas fantasma como forma de estafar al pueblo. Ahora bien, las que no son empresas fantasma pero también deberían investigarse a fondo son las compañías ligadas al mismísimo Manuel Bartlett. Seguramente le piden consejos de amontón, porque logró comprar casas en solo cuatro millones de pesos en las Lomas de Chapultepec. ¡No deje escapar este garbanzo de a libra! No hubo PAN duro Quienes apostaron por la división del PAN perdieron y gacho. En su 24 Asamblea Nacional los panistas dieron un mensaje de unidad. Ricardo Anaya no estuvo presente porque uno de sus hijos se enfermó y su esposa no estaba en México, así que se quedó a cuidarlo. Ah, me dirán que los gobers también faltaron. Bueno, no todos. Y fue por temas de agenda, pero los ausentes mandaron videos. Los más aplaudidos fueron Fox, después Marko Cortés y Enrique Vargas. Santiago Creel estuvo oImsoNenz socorrido para las selfies. Gustavo de Hoyos dio el gran mensaje de los empresarios y Mariana Gómez del Campo regresó con todo como consejera nacional. La unidad de los panistas seguramente la envidian en otros partidos ya que unos días después de la asamblea mostraron su músculo luego de que Morena en el Senado planteó la desaparición de poderes en Tamaulipas y Guanajuato, lo que dio origen al #YoEstoyConMiCobernador, que se convirtió en trending topic en Twitter. En un Estado de Derecho se respetan las leyes: no se actúa con revanchismo ni se puede ganar a la mala lo que no se obtuvo en las urnas. Si algo es de reconocerse es precisamente el liderazgo de los gobers del Pan, quienes han sido la piedra en el zapato de Morena. Plantear la desaparición de poderes por la inseguridad en primera ni está en la ley y, en segunda, si por eso fuera ya hubieran puesto los ojos en entidades como Guerrero o Morelos. Así que, por favor, seamos serios. Estilo mata carita... El embajador de México en el Vaticano, Alberto Barranco, comparó a AMLO con el Papa Francisco porque ambos son austeros y tienen compromiso con los pobres. ¡Quiúbole!"
81752437,['Javier Oliva Posada'],REVISTA,2019-09-29T12:43:18Z,Poder Nacional // El concepto de activismo criminal en México,Vértigo,IMPRESO,Columna Política,Semanario Político,37080.0,Nacional,"Fue en el grupo autodenomiado Estado Islamico (EI) de Siria, la la primera organización terrorista en grabar los suplicios y ejecuciones de sus rehenes. Las imágenes y métodos fueron rápidamente asimilados por los grupos delictivos mexicanos. Desde sitios específicos para deliberar” o lanzar amenazas contra bandas enemigas, como el Blog del narco, abrían una siniestra etapa en la actividad criminal: incursionar en la propaganda mediática. Las redes digitales de comunicación también comenzaron a ser utilizadas por despiadados criminales para perseguir y asesinar a activistas en contra de la delincuencia, periodistas y ciudadanos que simplemente habían denunciado algún ilícito. Cada vez de forma más sofisticada e incluso adaptando escenarios” las bandas delictivas en nuestro país han dado un salto cualitativo (negativo, se entiende) en la creación y proyección de videos difundidos ampliamente mediante la vía del internet y sus aplicaciones. No ha sido suficiente difundir torturas y ejecuciones: desde hace algunos meses, no más de un año, vienen proliferando testimonios de grupos de delincuentes, uniformados, con potente armamento, pero sobre todo utilizando un lenguaje procaz (no podía ser de otra forma) para advertir a otros líderes de mediana o regular influencia en una demarcación determinada. Varias han sido las denominaciones o clasificaciones respecto de las relaciones entre los procedimientos de las organizaciones terroristas y las motivaciones de los grupos criminales (sobre todo los dedicados al narcotráfico). Mensajes Desde los círculos conservadores de Estados Unidos, sean medios de comunicación, líderes de opinión pública, representantes de partidos políticos, centros de estudio (think tanks) o las agencias y dependencias gubernamentales de ese país, se han impulsado los siguientes términos: narcoterrorismo, narcoguerrilla e insurgencia criminal. El objetivo es a todas luces propiciar en términos políticos y jurídicos una asimilación del crimen organizado como un subproducto del terrorismo. Aunque sin las reivindicaciones expresas que les dan origen (cuatro son las causas esgrimidas por los especialistas en terrorismo: separatismo, religión, etnia, ideología, y frecuentemente se mezclan más de una de esas causales), la asociación se da sobre todo a partir de los violentísimos procedimientos aplicados contra las bandas rivales, contra las autoridades en general y contra la población abierta. En el caso de México desde hace poco tiempo —no más de un par de meses — las organizaciones criminales, sobre todo Nueva Generación y la reorganización de la Familia Michoacana, han difundido videos acompañados de mensajes dirigidos a la población”. En los mismos se refiere que han llegado a determinados lugares (ellos les llaman plazas) para proteger” a la población de la delincuencia común, así como del secuestro y extorsión. Argumentan —es un decir— que los pobladores de bien no deben temer a su presencia ya que los enemigos son las bandas rivales y están allí para limpiar” de delincuentes comunes y organizados. A esta novedosa forma de comunicar le denomino activismo criminal. Volveremos sobre el tema en siguientes entregas. El objetivo es a todas luces propiciar en términos políticos y jurídicos una asimilación del crimen organizado”."
