id,authors,category,date,header,medium,format,genre,mediumType,price,section,text
81588954,['Alberto Barranco'],REVISTA,2019-09-22T13:09:15Z,Los 100 años con Don Porfirio,Vértigo,IMPRESO,Artículo,Semanario Político,44510.6,Nacional,"Juntos, pero no revueltos: caballeros de levita y sombrero de copa, damas alhajadas y encopetadas esparcían sus olores y primores en los salones de Palacio Nacional; pelados, rotitos, marchantas, gendarmes, jicareros, en la plancha la multitud recibió la llegada de 1910 a Zócalo pleno. El estallido intermitente de cohetones apagaba los gritos mientras las bengalas, los castillos, la catarata de juegos pirotécnicos volvía arcoíris el infinito. El año del centenario. Ocho antes el presidente Porfirio Díaz había empezado a trazar la escenografía con la integración de la Comisión de festejos por más que en 1901 se había colocado la primera piedra de la Columna de la Independencia. La casa por la ventana en la demostración de un México de orden y progreso.Adiós a las guerras civiles. Adiós al bandidaje. Adiós al libertinaje. Y como lo primero es lo primero un grupo de mujeres de la más alta sociedad, con el encabezadas por la primera dama, Carmelita Romero Rubio de Díaz, lanzaron una campaña de alfabetización. .. que logró el milagro de juntar las letras en 350 campesinos. Para no dar mal aspecto a los embajadores especiales de todos los países el mismo grupo hizo una gran colecta para uniformar de caqui a los niños de la calle. Sus zapatones mineros, su sombrero ... Y todos los hoteles de lujo, el Geneve de la colonia Juárez a la cabeza, prepararon sus mejores habitaciones. La única ausencia fue de Gran Bretaña dado el luto por la muerte del rey Eduardo VII, aunque de último minuto tampoco llegó República Dominicana. Y aunque Nicaragua envió un embajador especial de lujo, el poeta Rubén Darío, le dijeron: Usted perdone pero no trae acreditaciones oficiales”. Esplendor Ahora que cada país envió su regalito: España, un uniforme de campaña que había usado el generalísimo José María Morelos y Francias, las llaves de la Ciudad de México que se ke habian entregado innoblemente al general Forey, cuando su ejército invasor la envolvió; China, el reloj emblemático de Bucareli; Gran Bretaña, el reloj de cuatro caras de Pachuca; la colonia libanesa, a nombre del pueblo otomano, el reloj turco de la Plaza de la Ranita, con esta como pilón tocando un laúd.... En el refuego de inauguraciones llegaría el manicomio de La Castañeda de Mixcoac, construido por el ingeniero Porfirio Díaz; el Hemiciclo a Juárez; el edificio de la Escuela Normal de Maestros; el Parque Balbuena y, naturalmente, la Columna de la Independencia, en un enjambre de bibliotecas públicas, kioscos, portales. .. Y luz, mucha luz. Millones de foquitos abrazados al Palacio Nacional, el edificio del Ayuntamiento, la Catedral y, naturalmente, el de la Compañía de Luz llegaría y Fuerza de la calle de Gante. El esplendor llegaría con el baile de gala de Palacio Nacional el 22 de septiembre, con cinco mil invitaciones al calce, miles de enredaderas y guirnaldas y una vajilla con el escudo nacional mandada hacer en Francia. La música tenía la firma de la orquesta de los vascos Jordá y Rocabuena. El premio de consolación para los que no pudieron entrar fue una serie de bailes en el Tívoli del Elisco, el teatro Vicente Guerrero, el teatro Cuillermo Prieto, los mercados de San Juan, San Lucas y San Cosme, con aguas de horchata a cuenta de don Porfirio.. . aunque se coló el palquito. Días antes, el 16, la madre de todos los desfiles, en una escenografía que retrataba la historia de México: los aztecas, las armaduras españolas, los uniformes de los jefes insurgentes, el país imdependiente... La serpentina, por Paseo de la Reforma, la encabezó el estandarte de la Virgen de Guadalupe que enarboló el cura Hidalgo 100 años antes. El encanto se rompería el 20 de noviembre. El esplendor llegaría con el baile de gala de Palacio Nacional el 22 de septiembre”."
81132222,['Magu'],REVISTA,2019-09-02T11:33:42Z,Monigoterías // Bartlett y la Cuaternaria Transformación,Vértigo,IMPRESO,Cartones,Semanario Político,10167.9,Revista,"[OARRA7. ADORADOR DEL CARBON, EL DIRECTOR DELA CFE _2 k—350 AL EXTRENO CONTRA LOS GASODUCTOS, € o www.vertigopolitico.com 15"
81132347,['Rafael Hernández'],REVISTA,2019-09-02T11:39:37Z,Voces para El Bronce // Manotazos,Vértigo,IMPRESO,Cartones,Semanario Político,68116.8,Revista,"llustración de Rafael Hernández con base en la obra Oliver Cromwell y John Milton, de Charles West Cope (1811-1890). Los procesos en Morena para elegir al presidente del Senado y al nuevo [N nacional del partido provocan un ambiente belicoso al in?eripr [ CEE EO el primer morénista de la nación advierte a sus huestes que si continúan con su talante . yea uai — — e NEE TA pendenciero renunciará y se llevará hasta el lo yeee C para dejarlo claro manda Voces para el bronce al carajo” a los ambiciosos vulgares”."
81133238,['Rafael Hernández Herrera'],REVISTA,2019-09-02T12:19:18Z,Emblemas Políticos // Espejo de Príncipes,Vértigo,IMPRESO,Cartones,Semanario Político,3877.52,Revista,"De Idlib salen cientos de miles El éxodo sirio no tiene fin, huyendo del yugo yihadista. la persecución no descansa: Sus cuerpos lucen febriles cuando el presente es ruin y no hay remedio a la vista. ni la esperanza alcanza. www.vertigopolitico.com 39"
81269723,['Magu'],REVISTA,2019-09-07T13:29:56Z,Monigoterías // Epidemia de reeleccionismo en la 4T,Vértigo,IMPRESO,Cartones,Semanario Político,10042.3,Nacional,"EPIDEMIA DE REELECCIONISMO EN LA 4T 19 u AOO MUÑOZ LEDO SE BAJAA — MA CURARSE é EN SALUD. — U BATRES SUFRE ESPASMOS PORLA CALENTURA Y POR PERDER LA REELECCIÓN.., DRAZN TE AO MADERO BUSCA PROTEGER RO NN 2TSN EL EMBLEMA DE 5U e . UN Y ¡x-,_.5 xx* COOP¿IHAC¡ON¡Í( 25 0U > . d k e. ¿NE ÍENADÓ /¡/(// A |3… — /_ ( C MONIGOTERÍAS Magú magu85(Ogmail.com"
81269982,['Rafael Hernández'],REVISTA,2019-09-07T13:52:38Z,Voces para el bronce // Perseverancia,Vértigo,IMPRESO,Cartones,Semanario Político,56078.9,Nacional,Andres Manuel López Obrador Arturo Herrera E ECN TT) pue (e ! aEOO asa;eros que r;qwer¿ C Presupuesto |
81270129,['Redacción'],REVISTA,2019-09-07T14:06:18Z,Teloneros // sismo político,Vértigo,IMPRESO,Cartones,Semanario Político,1236.53,Nacional,"L O R S abrupta, ni elecciones anticipadas, caray, así no se puede gobernar!"
81436212,['Magu'],REVISTA,2019-09-14T11:11:57Z,Monigoterías // Tiemblan los criminales...,Vértigo,IMPRESO,Cartones,Semanario Político,53529.0,Nacional,— ESMOS + ANORIZADOS — AUSRLAS - NUEJASAMAS ENCUSTAS DELEJNCTO: — LASACALAS UO GUACALAS a MONIGOTERÍAS *¿&! Magú ANAN | MAgUS5Ogmail.com TIEMBLAN LOS CRIMINALES... AL FIN SE HA DISEÑADO LA MÁS LETAL DE LAS POLÍTICAS DE SEGURIDAD NACIONAL — — _— U s y o EsMOS 1 AUORIZADOS AUMUS - — NUEMSARMAS — É — EneSAS — DELEFACIO: 558 — LASUCHILAS E YNO GUACALAS — X V LOS Y A $ g;f -
81436375,['Rafael Hernández'],REVISTA,2019-09-14T11:23:45Z,Voces para el bronce // Validez constitucional,Vértigo,IMPRESO,Cartones,Semanario Político,59890.7,Nacional,constítué£ e y C d e que engda Carta Magna de la CDMX se reconozca med¡co y tera TTaTeo ) la marihuana. Con elto la sciI __ y h. . É . a * o A médico y teraB;ut¡co de la marihuana. Con ello la SCN U n la obra Henri Sainte-Claire ra e I Hernández%o aTa Tel a- E-To 11 ñ S Erema Corteyd!]us&a de la Nación validó la P E que quienes lo requieran tengan acceso al producto.
81436764,['Rafael Hernández Herrera'],REVISTA,2019-09-14T11:58:31Z,Espejos de príncipes,Vértigo,IMPRESO,Cartones,Semanario Político,4540.79,Nacional,"ESPEJO DE PRÍNCIPE S eee Herer Un intenso estira y afloja Boris Johnson no cede nada, a Reino Unido tiene en vilo. y menos aún su oposición: Con la fragilidad de una hoja, cada cual con su cruzada, Su estabilidad pende de un hilo. El Brexit deja solo división."
81589227,['Magu'],REVISTA,2019-09-21T13:34:33Z,Monigoterías // Aprovechar tianguis prehispánico,Vértigo,IMPRESO,Cartones,Semanario Político,11377.9,Nacional,"Z O, PERO NO PUDO,DETENER MEX,C£!&$(¿BASTA CON PIEZAS DEL PATRIMONIO CULTURAL MEXICANO ARTE P RECºL?M&! No ESTATUILLAS AZTECAS PARÍS-FRANCIA Al namr.. AYUDENOS SUBASTANDO -N NUGSTRO AViIÓN v A K EÍ|DENCIAL f ACENO - N de uu¡Tz¡%vºcm ¡¡3)W VEZ u7 — UNACOPIA dia 24 M Al HACEN FALTA BECAS CE dN > MONIGOTERÍAS g Magú u magu8s5Ogmail.com"
81589572,['Teloneros'],REVISTA,2019-09-21T14:04:11Z,El Buen Pastor,Vértigo,IMPRESO,Cartones,Semanario Político,5341.89,Nacional,36 22 de septiembre de 2019 ¡Entre todos Papa Francisco El buen pastor
81752014,['Magu'],REVISTA,2019-09-28T12:04:31Z,Surtido Rico,Vértigo,IMPRESO,Cartones,Semanario Político,38048.9,Nacional,MONIGOTERÍAS Magú magus5Ogmail.com PA AA AY gú magus5Ogmail.com - ¡c&. Secretario de salud Jorge Alcocer Varela diciendo a un enfermo que no hay medicinas TE S sis SALUD D v
81752548,['Rafael Hernández Herrera'],REVISTA,2019-09-28T12:50:45Z,Espejo de príncipes,Vértigo,IMPRESO,Cartones,Semanario Político,52688.9,Nacional,"Emblemas políticos de Rafael Hernández Herrera CIENCIA FORESTAL . v Un cúmulo de errores al Congo y su bosque aqueja; a nuestros mayores pulmones el hombre sobrevivir no deja. Contaminación, una causa; sobrepoblación, otro lastre. Urgen acciones sin pausa: urge parar el desastre. Un cúmulo de errores Contaminación, una causa:; al Congo y su bosque aqueja; sobrepoblación, otro lastre. 1 nuestros mayores pulmones Urgen acciones sin pausa: el hombre sobrevivir no deja. urge parar el desastre. EN IUTA Grupo de personas trabajando en su día a día"
81133120,['Guillermo Deloya Cobián'],REVISTA,2019-09-02T12:13:57Z,Palabras Articuladas // La felicidad interna bruta Ogdeloya Y Qegdeloya E Guillermo Deloya www.guillermoadeloya.com.mx g_deloya(Ohotmail.com,Vértigo,IMPRESO,Columna Cultural,Semanario Político,31697.3,Revista,"9 Puede un país como nuestra nación transitar en el duro devenir económico y social con una sonrisa en la cara y luminosidad en el ánimo? Por más sorprendente que resulte, al menos en la respuesta directa contenida en encuestas, sí existe la posibilidad de compaginar adversidad con optimismo y percepción de bienestar. En reciente medición se sabe que México se encuentra en el lugar 23 de 187 a nivel internacional en grado de felicidad, lo que en América nos coloca solo debajo de Estados Unidos, Canadá y Costa Rica. En una escala del uno al diez el promedio de encuestados contestó que estiman ubicarse en 7.4 cuando se les preguntó ¿Es usted feliz?” Pero he aquí un dato interesante: se les preguntó ¿es usted feliz con su país?” y ahí el común de resultados decrece a 5.9 de calificación. Sfestamos felices pero no felices con todo lo que acontece en nuestro entorno. Quizá no sería para menos cuando tenemosa la vista algunos indicadores que apuntalan el tema. Recapitulo sobre lo más lamentable en que la desesperación por infelicidad deriva. n México en 2016 ocurrieron seis mil 291 muertes porsuicidio, esdecir, 17 diarios. Esta cifra ha incrementado gradualmente hacia nuestros días hasta en 5% más por año. Generalmente la gran mayoría de estas atroces acciones se dan en el marco de la precariedad económica yla desesperanza afectiva. En cuanto al primer componente, cuatro de cada diez personas son pobres; es decir, >2.4 millones de mexicanos o 41.9% de la población. En correlación a ello la Encuesta nacional de ocupación y empleo abril-junio 2019 nos muestra que la población desocupada fue de dos millones de personas y la población ocupada informal llegó a 30.9 millones de personas. Los ingresos totales reales por suministro de biencs y servicios mostraron un retroceso de -0.6% y el índice de los gastos totales por consumo de bienes y servicios cayó -6%. La economía nacional se encuentra enla línea horizontal del estancamiento conforme al int:CI. Panorama En cuanto a la desesperanza afectiva avizoramos destellos al saber que México es un país que tiende a acrecentar cifras que denotan desintegración familiar. En lo referente a los divorcios el indicador ha ido en alza: en 2010 fueron 86 mil; en 2013 la cifra fue de aproximadamente 109 mil, y en 2017 el dato se acerca a los 150 mil. Sin contar aún con la cifra actual para 2019 se estima que la misma ronda en los 250 mil. El panorama se redondea cuando nos percibimos en una situación de vulnerabilidad creada por la ya tan comentada criminalidad rampante que nos lesiona como país. Es ahí donde con datos del o1n9soMenz Felicidad personal y colectiva. Secretariado Ejecutivo del Sistema Nacional de Seguridad Pública sabemos que en este pasado junio se contabilizaron tres mil 80 nuevos casos de personas asesinadas, que sumados a los meses anteriores arroja un total de 17 mil 608 víctimas de homicidio y feminicidio en el primer semestre del año. Se trata de una tasa de casi 14 asesinatos por cada 100 mil habitantes, récord en al menos 22 años. Yapesar de todo no eslejana a la realidad la aserción presidencial: El pueblo está feliz”. Si nos apegamos a la filosofía epicúrea, en testimonio que los hombres pueden alcanzar fácilmente la felicidad siempre y cuando sc hayan satisfecho ciertas necesidades indispensables, la aparente contradicción podría tornarse comprensible. La felicidad en dicho sentido no es más que la ausencia de dolor físico y un estado de ánimo libre de cualquier turbación o pasión. Ha sido elevada a calidad de derecho fundamental, subrayadamente en la tradición anglosajona que estableció en 1776 el derecho a la vida, a la libertad yalafelicidad. Incluso el concepto campea en la lógica lopezobradorista que incorpora a la vida pública este parámetro como irrenunciable. Recordar qué aventurado fue cuando en 2012 propuso la creación de la secretaría de la felicidad. Y sin embargo Ipicuro de Samos al definir la felicidad como bien supremo advirtió del esfuerzo material que la antecede. No todo es percepción: una patria fuerte y mejorada en indicadores que hoy denotan complejidad será una patria donde se equilibre un real y tangible desarrollo reflejado en el P8, con un percibido y satisfactorio bienestar traducido a felicidad personal y colectiva."
81134718,['Sergio Perezgrovas'],REVISTA,2019-09-02T13:30:02Z,En Medio del Espectáculo // Libro de Félix Fuentes,Vértigo,IMPRESO,Columna Cultural,Semanario Político,32947.2,Revista,"uando Tristán Canales Najjar (no el personaje sino el hombre) me llamó a su oficina para decirme que quería un nuevo programa con su amigo Wélix Fuentes nunca me imaginé que encontraría en él a un ser fascinante. Comenzamosa trabajar y poco a poco se desarrolló en este medio llamado televisión, siempre atento a mis comentarios y observaciones con una puntualidad y pulcritud extraordinarias. Normalmente nos vamos a desayunar para preparar el programa junto con Raúl Sánchez Carrillo —al principio también con Francisco Rodríguez pero al poco tiempo se fue. En csas sesiones de trabajo noté que don Félix poseía una memoria eidética (llamada memoria fotográfica). Después de trabajar un par de meses comenzamos a reunirnos fuera del canal para comer y conversar. Ah, qué buen narrador resultó en las sobremesas. Hemos estado en un sinfín de restaurantes: cl Ambrosía, el Camino Real, el San Ángcl Inn, La Bottiglia, el Nobu, la Cuadiana, la cantina Monterrey (donde dan unos tacos de guisado buenísimos).... Solo nos faltan el Toks y el Vips porque el Dennys ya nos lo cerraron. En más de una ocasión me ha tumbado con los tequilas. En alguna de esas pláticas le pregunté que por qué no escribía sus memorias. Volteó a verme y me dijo: ¿Por qué no, cabrón?” Aunque él ya tenía la idea de hacerlo desde hace tiempo finalmente se convenció y comenzó a escribir. Este proceso se llevó más o menos tres años y yo, sin saber, me fui convirtiendo en su corrector de estilo ya que me pasaba hojas y hojas para que viera cómo caminaba su libro (en realidad la corrección la hizo Elda Ramos). Asíllegamos al final del principio (yo y mi pinche bocota): le dije que conseguiría un editor. Para entonces el libro ya tenía 300 cuartillas, así que me diala tarea de buscar a alguien que lo publicara. Conocí, gracias a la ayuda de mi amiga Sofía López, a José Miguel Porrúa. Al cabo de un tiempo le pregunté si podía avudarnos con el libro. Inmediatamente me dijo que sí, concertamos una cita y empezó el desarrollo de las memorias; idas y vueltas de correos, y así pasaron tres meses, hasta que estuvo terminado. En él encontrarán pasajes muy interesantes de cómo don Félix sufrió suinfancia, por qué dejó de estudiar en Chapingo y sc introdujo en el mundo del periódico ABC, trabajando casos tan conocidos como el 2 de octubre en 1965 o el de Las Poquianchis, su gran amigo Manuel Buendía, su relación con secretarios de Hstado, el Papa Juan Pablo 11, presidentes y su cercanía con Salinas de Gortari entre muchos otros. El leer hace completo al hombre, el hablar lo hace expedito, el escribir lo hace exacto. León Tolstói Cusdad de Mári —————————_———| —PÉLIN FUENTES- E , 1 7 ¡REPORTERO EPORTFTO! — E EZ Siempre puntual, exacto y con datos que sorprenderían a cualquier editor de diccionarios el libro nos revela sus 60 años dedicados en cuerpo y alma al oficio del reportero. En fin, un gran legado para sus hijos, sus nictos y sobre todo para entender mejor la historia de los últimos sucesos en nuestro país. Agradezco a Tris que nos haya puesto en la misma sintonía: sin duda el que más ha ganado en esta relación soy yo. El libro lo pueden encontrar en las Librerías Porrúa con el título de Félix Fuentes ¡reportero! La vida y sus misterios siempre me sorprenden mandándome a este tipo de personas. Hoy, a sus 86 años, conozco al hombre más joven de espíritu, con una vitalidad que desearían algunos de los deportistas de los Juegos Panamericanos. Padre amoroso preocupado por sus hijos y nietos y por su mujer (Leonora); amante del golf; generoso (nunca me deja pagar), pero sobre todo un ser humano fuera de serie con valores que ya no sc encuentran tan fácilmente: honesto, trabajador y cumplido. Vaya pues una felicitación por este gran logro de Félix. El amigo Tris conocía a Félix Fuentes por aquel famoso caso de las asesinas de San Francisco del Rincón: cuatro hermanas de la familia González Valenzuela que tenían un prostíbulo itinerante y que mataban a sus pupilas y luego las enterraban. Se dice que asesinaron a casi 150 prostitutas, bebés y algunos clientes. El papá de ristán llevó el caso y se lo contó a su hijo. Ahí comenzó su vocación. — EditoriaPorrúa. Gran legado. Sergio Pérezgrovas (Oserperezgrovas sgrovasOyahoo.com.mx peridimo vecar e idependiene s eiido por Nena enuog — -"
81135327,['Mónica Soto Icaza'],REVISTA,2019-09-02T13:56:50Z,Por una Vida Sexy // Ser víctima O monicasotoicaza Y (Amonicasotoicaza E monicasotoicaza letrasvidaytacones(Ogmail.com llustración R. Hernandez,Vértigo,IMPRESO,Columna Cultural,Semanario Político,35885.1,Revista,"s que publico poemas eróticos y fotos en poses sugerentes. Por eso me lo merezco. Es porque me divorcié y tengo un novio 26 años mayor. Y algunas otras interacciones ocasionaEa les (las cuales no son un secreto para nadic). Es porque voy a cumplir 40 años. Es porque me atrevo a hablar y escribir de sexo y relaciones sentimentales y humanas con libertad. Es porque soy mujer y todas las mujeres somos putas —algunas de clóset, otras descaradas. Por eso me gané el acoso del que he sido objeto desde hace ya 17 meses. Víctima es una palabra con la que jamás mc he identificado; toda la vida me he ocupado de hacerme responsable de mis decisiones, de acatar las consecuencias de mis acciones y omisiones con humildad y fuerza. Por eso ahora que llevo más de 500 días recibiendo agresiones y amenazas de alguien anónimo por el simple hecho de existir y trabajar en lo que más me apasiona, lo más difícil ha sido aprender a asumirme como tal. Según la Real Academia Española una víctima es: 1. Persona o animal sacrificado o destinado al sacrificio. 2. Persona que se expone uofrece a un grave riesgo en obsequio de otra.3. Persona que padece daño por culpa ajena o por causa fortuita. 4. Persona que muere por culpa ajena o por accidente fortuito. >. Der. Persona que padece las consecuencias dañosas de un delito. El primer mensaje del que tengo registro fue el 2 de mayo de 2015 (los reproduzco con faltas de ortografía y redacción, tal cual lle- garon): lu perfil parece una pagina de divas pero de baja calidad. Vulgar fea y urgida. Muy vieja señora para actuar asi pensar mejor no se ve bien usted”. No fue el primero, pero como ya era el quinto o sexto, decidí empezar a guardarlos, por si las dudas. Evidencia Las agresiones fueron escalando al punto de amenazar la integridad de mis hijos: que mujer tan distorsionada y loca eres, ruego a Dios que mi hija no salga asi por que como padre esta cabron y te doy un consejo? ya deja a los casados en paz, por que puede ser peligroso, y teniendo hijos mas, estas loca y tienes cara de loca y admas eres puta en toda la extension de la palabra pobrecita de ti, escribes puras pendejadas nada que aporte algo a la humanidad”. Fl 17 de agosto mostró su vocación política: que floera de mujer de perfil y de mentalidad, ponte a trabajar hija de Morena, en serio por eso esta el pais Mexico coo esta huevona, fea corriente”. Pero el 1 de octubre, en el contexto de la cantidad de mujeres desaparecidas y asesinadas en México, llegó el mensaje que me llevó a la Procuraduría General de la República (hoy Fiscalía General de la República) a levantar una denuncia ante el Ministerio Público por amenazas: ESTAS SYUPER PINCHE PINCHE VIEJA FEA Y DESUBICADA PONTE A CHAMBEAR AL MENOS UNA PUTA ES MAS RESPETABLE QUE TU PINCHE MOSCA MUERTA ADMAS SOLO TE METES CON CASADOS POR QUE ERES TAN POCA MUJER QUE NO PUEDES OCNSEGUIRTE UNOS PARATI SINCOMPROMOSIO NOTE VAYAN A MATR O VIOLAR A TU HIJA POR ADARSE METIENDO DONDENO”. Ahí empezó mi camino de declaraciones, tres ministerios públicos diferentes, policía cibernética, incontables narraciones de los hechos y sí, tener que defenderme contra la revictimización que algunos funcionarios están acostumbrados a ejercer contra quienes tienen la valentía de no quererse convertir en víctimas de un delito. Hoy que escribo, estimado lector, me preparo mental y emocionalmente para un requisito indispensable para continuar con la investigación: una pruceba sicológica con una perito especialista en la materia, porque resulta que si las agresiones y amenazas no han afectado mi forma de vivir, entonces no hay delito qué perseguir. Aunque la evidencia existente sean ya más de mil mensajes en 17 4 . meses. Porque si eres una mujer violentada que en vez de sentir miedo siente rabia entonces no necesitas justicia. M"
